{
  "schemaVersion": "1.0.0",
  "fixtureSetId": "evals.weather_only_regression",
  "version": "1.0.0",
  "experimentId": "sha256:aaaaaaaaaaaaaaaaaaaaaaaaaaaaaaaaaaaaaaaaaaaaaaaaaaaaaaaaaaaaaaaa",
  "sourceRun": {
    "runId": "12345678-1234-4abc-8def-1234567890ab",
    "executedAt": "2026-07-16T19:00:00Z"
  },
  "projection": {
    "projectionId": "datasets.weather_only",
    "version": "1.0.0",
    "artifactSha256": "bbbbbbbbbbbbbbbbbbbbbbbbbbbbbbbbbbbbbbbbbbbbbbbbbbbbbbbbbbbbbbbb"
  },
  "traceContract": {
    "schemaId": "urn:agentcore-evals:schema:execution-trace:1.0.0",
    "schemaVersion": "1.0.0",
    "canonicalizerVersion": "1.0.0",
    "sourceProfile": {
      "profileId": "strands-inline",
      "version": "1.0.0"
    }
  },
  "expectedCaseIds": [
    "tc-0001",
    "tc-0090"
  ],
  "fixtures": [
    {
      "exampleId": "tc-0001",
      "status": "canonical-trace",
      "path": "evals/fixtures/weather-only-62/traces/tc-0001.json",
      "sha256": "cccccccccccccccccccccccccccccccccccccccccccccccccccccccccccccccc"
    },
    {
      "exampleId": "tc-0090",
      "status": "instrument-error",
      "path": "evals/fixtures/weather-only-62/errors/tc-0090.json",
      "sha256": "dddddddddddddddddddddddddddddddddddddddddddddddddddddddddddddddd",
      "errorKind": "TelemetryNormalizationError"
    }
  ],
  "counts": {
    "expected": 2,
    "canonicalTrace": 1,
    "instrumentError": 1
  },
  "publicSafety": {
    "policyId": "safety.exact_synthetic_fixture",
    "version": "1.0.0",
    "publicationMode": "exact-source-artifacts",
    "automatedChecks": [
      "schema",
      "semantics",
      "provenance",
      "secrets",
      "privatePaths",
      "awsIdentifiers",
      "contactIdentifiers"
    ]
  }
}
